{
  "schema_version": 1,
  "example_id": "SQL-GC-0839",
  "document_id": "DBKB-ISQL-0007",
  "environment": "sqlite-local",
  "engine": "sqlite",
  "engine_version": "3.46.1",
  "executed_at": "2026-09-30T06:39:57.471488+00:00",
  "statement_sha256": "974c1d14c674acc8e6fd2a30a9cf9a82bde84c39c7d78f10cd92f25029232c6d",
  "status": "PASS",
  "actual_rows": [
    [
      1678
    ]
  ]
}
