{
  "schema_version": 1,
  "example_id": "SQL-GC-0734",
  "document_id": "DBKB-FND-0007",
  "environment": "sqlite-local",
  "engine": "sqlite",
  "engine_version": "3.46.1",
  "executed_at": "2026-09-30T06:38:08.830755+00:00",
  "statement_sha256": "de2e626a7c7597e9623ce0044f3b1aeef2917a444082a0308b916223ac218d66",
  "status": "PASS",
  "actual_rows": [
    [
      734,
      "X"
    ]
  ]
}
