{
  "schema_version": 1,
  "example_id": "SQL-GC-0575",
  "document_id": "DBKB-ISQL-0010",
  "environment": "sqlite-local",
  "engine": "sqlite",
  "engine_version": "3.46.1",
  "executed_at": "2026-09-30T06:39:56.632975+00:00",
  "statement_sha256": "bb9e2a56755ab92e6d00735465cfc4e009f75197263ce447da291c2333202e52",
  "status": "PASS",
  "actual_rows": [
    [
      1,
      2
    ]
  ]
}
