{
  "schema_version": 1,
  "example_id": "SQL-GC-0535",
  "document_id": "DBKB-ASQL-0002",
  "environment": "sqlite-local",
  "engine": "sqlite",
  "engine_version": "3.46.1",
  "executed_at": "2026-09-30T06:38:08.318978+00:00",
  "statement_sha256": "f72bcaf62b8019f18ded05d71bf254c9a84a3b7d5e5e7d8161d12c1c09a1d8ce",
  "status": "PASS",
  "actual_rows": [
    [
      1,
      2
    ]
  ]
}
