{
  "schema_version": 1,
  "example_id": "SQL-GC-0096",
  "document_id": "DBKB-ASQL-0008",
  "environment": "sqlite-local",
  "engine": "sqlite",
  "engine_version": "3.46.1",
  "executed_at": "2026-09-30T06:39:54.912222+00:00",
  "statement_sha256": "739e349ba70b38fdcad8d64cec92f942a1cf00e4e0cd2db380a937126f5cf0eb",
  "status": "PASS",
  "actual_rows": [
    [
      "positive"
    ]
  ]
}
