{
  "schema_version": 1,
  "example_id": "SQL-GC-0344",
  "document_id": "DBKB-SQL-0012",
  "environment": "sqlite-local",
  "engine": "sqlite",
  "engine_version": "3.46.1",
  "executed_at": "2026-09-30T06:38:07.449327+00:00",
  "statement_sha256": "79887e0733679e5a6ee3c575822e5a8dad95497f6af6ef22e1d633479a06e95d",
  "status": "PASS",
  "actual_rows": [
    [
      344,
      "X"
    ]
  ]
}
