{
  "schema_version": 1,
  "example_id": "SQL-GC-0600",
  "document_id": "DBKB-RDBE-0006",
  "environment": "sqlite-local",
  "engine": "sqlite",
  "engine_version": "3.46.1",
  "executed_at": "2026-09-30T06:38:08.488238+00:00",
  "statement_sha256": "4414f27c5dba94d9c1f7e1d32b3184efc561b5300c210e9487e76fda71adee8d",
  "status": "PASS",
  "actual_rows": [
    [
      600
    ]
  ]
}
