{
  "schema_version": 1,
  "example_id": "SQL-GC-0825",
  "document_id": "DBKB-FND-0011",
  "environment": "sqlite-local",
  "engine": "sqlite",
  "engine_version": "3.46.1",
  "executed_at": "2026-09-30T06:39:57.438469+00:00",
  "statement_sha256": "1a23b2f49550b52a394cc8305cb415c31dad5f3f5eb314ce9382796575f718a3",
  "status": "PASS",
  "actual_rows": [
    [
      1,
      2
    ]
  ]
}
