{
  "schema_version": 1,
  "example_id": "SQL-GC-0308",
  "document_id": "DBKB-ISQL-0010",
  "environment": "sqlite-local",
  "engine": "sqlite",
  "engine_version": "3.46.1",
  "executed_at": "2026-09-30T06:39:55.688275+00:00",
  "statement_sha256": "78cc4722269d74d106cd3983fef9c013e8f8751d2775fc6893ec9ca15f2d71c0",
  "status": "PASS",
  "actual_rows": [
    [
      308,
      1
    ],
    [
      309,
      2
    ],
    [
      310,
      3
    ]
  ]
}
