{
  "schema_version": 1,
  "example_id": "SQL-GC-0290",
  "document_id": "DBKB-FND-0010",
  "environment": "sqlite-local",
  "engine": "sqlite",
  "engine_version": "3.46.1",
  "executed_at": "2026-09-30T06:39:55.629947+00:00",
  "statement_sha256": "1ca95ef192ffae4b1ff522ba533e519241e73aa6b8e95103150abaa56d884943",
  "status": "PASS",
  "actual_rows": [
    [
      290
    ]
  ]
}
