{
  "schema_version": 1,
  "example_id": "SQL-GC-0853",
  "document_id": "DBKB-ISQL-0021",
  "environment": "sqlite-local",
  "engine": "sqlite",
  "engine_version": "3.46.1",
  "executed_at": "2026-09-30T06:39:57.506660+00:00",
  "statement_sha256": "40227ff04d512a7605fb876385dcd224782d45917bc6328b209d84d13a37f682",
  "status": "PASS",
  "actual_rows": [
    [
      "a",
      2,
      1707
    ],
    [
      "b",
      1,
      855
    ]
  ]
}
