{
  "schema_version": 1,
  "example_id": "SQL-ASQL-0002",
  "document_id": "DBKB-ASQL-0002",
  "environment": "sqlite-local",
  "engine": "sqlite",
  "engine_version": "3.46.1",
  "executed_at": "2026-09-29T10:33:10.909919+00:00",
  "statement_sha256": "f930707fdaee695e20e452b620283b20ad7ac6e1f9011268a26b8e3a32c807dd",
  "status": "PASS",
  "actual_rows": [
    [
      1,
      10,
      100,
      150.0
    ],
    [
      2,
      10,
      200,
      150.0
    ],
    [
      3,
      20,
      50,
      50.0
    ]
  ]
}
