{
  "schema_version": 1,
  "example_id": "SQL-GC-0698",
  "document_id": "DBKB-SQL-0010",
  "environment": "sqlite-local",
  "engine": "sqlite",
  "engine_version": "3.46.1",
  "executed_at": "2026-09-30T06:38:08.737436+00:00",
  "statement_sha256": "06bfa948247ac2d8dd89ea83ee8107c9faa67ff97fb15e17f5f9ba6327ea278d",
  "status": "PASS",
  "actual_rows": [
    [
      698,
      1
    ],
    [
      699,
      2
    ],
    [
      700,
      3
    ]
  ]
}
