{
  "schema_version": 1,
  "example_id": "SQL-GC-0643",
  "document_id": "DBKB-ASQL-0028",
  "environment": "sqlite-local",
  "engine": "sqlite",
  "engine_version": "3.46.1",
  "executed_at": "2026-09-30T06:39:56.861152+00:00",
  "statement_sha256": "65ceece01e0013f2f69470c2fb13e30477f21ddb0911ec8a3b9887322ec91e7c",
  "status": "PASS",
  "actual_rows": [
    [
      "a",
      2,
      1287
    ],
    [
      "b",
      1,
      645
    ]
  ]
}
